ANESSA,ANESSA Perfect UV Sunscreen Aqua Booster Se...,HK$269.0
BIORE,SPF 50+ PA++++ Watery Essence Water Base (5...,HK$84.9
SUISSE PROGRAMME,Sun Block Lotion SPF30 (50ml),HK$192.0
Coppertone,SPF50 PURE & SIMPLE LOTION (237ml),HK$98.0
BIORE,BIORE UV AQUA RICH WATERY GEL SPF50 (90ml),HK$84.9
La Prairie,Cellular Radiance Emulsion SPF 30 (50ml),HK$2025.0
Banana Boat,UltraMist Sport Performance Sunscreen SPF 1...,HK$135.9
Clarins,UV Plus Anti-Pollution Day Screen Multi-Pro...,HK$323.0
Coppertone,UltraGUARD® Continuous Spray (177ml),HK$98.0
Elizabeth Arden,Prevage City Smart SPF50 Hydrating Shield (...,HK$488.0
NOV,SPF32PA+++ NOV UV MILK EX N/A 35G (35g),HK$200.0
Lancome,UV Expert Youth Shield™ Milky Bright (50ml),HK$440.0
Sofina,Whitening UV Cut Emulsion SP SPF50+/PA++++ ...,HK$224.0
NOV,SPF50+PA++++NOV UV SHIELD EX (30g),HK$250.0
SUISSE PROGRAMME,Total Sun Protection Cream (50ml),HK$396.0
Banana Boat,Aloe Vera Gel (230g),HK$72.9
Shiseido,WetForce Perfect UV Protector SPF50+ / PA++...,HK$290.0
AJUSTE,"Ajuste UV Spray SPF 50+ PA++++, Clean Savon...",HK$78.0
Kose Cosmeport,SPF50+ PA++++ UV Protect Gel (100ml),HK$69.0
BIORE,BIORE UV AQUA RICH ESSENCE SPF50 (ROSE) (50...,HK$84.9
Banana Boat,Banana Boat Ultra Protect Sunscreen Lotion ...,HK$87.9
LANEIGE,Sun Block Supreme SPF50+PA+++ (50ml),HK$140.0
LANEIGE,Sun Block Aqua+ SPF35 PA++ (50ml),HK$140.0
Shiseido,Expert Sun Aging Protection Lotion Plus SPF...,HK$290.0
Banana Boat,Banana Boat Ultra Protect Sunscreen Spray S...,HK$124.9
BIORE,Biore UV Aqua Rich SPF30 (90ml),HK$84.9
Banana Boat,Sport Sunscreen Lotion SPF110    (90ml),HK$98.9
ZA,"SPF50+PA++++POWER BLOCK UV, N/A, 50ML  (50m...",HK$115.0
Kose Cosmeport,Sun Cut Waterproof UV Gel (SPF50+PA++++) (1...,HK$79.0
Mentholatum,Sunplay Skin Aqua UV Whitening Moisture Gel...,HK$76.9
Banana Boat,Sport Coolzone Instantly Cool Refreshes Sun...,HK$124.9
Banana Boat,Banana Boat Sun Comfort Sunscreen Continuou...,HK$124.9
La Roche-Posay,DERMO-PEDIATRICS SPRAY SPF50+ PA++++ (200ml...,HK$269.0
AJUSTE,UV spray SPF50+ PA++++ (200g),HK$78.0
Mentholatum,Sunplay Super Block UV Body Mist SPF130/PA+...,HK$139.9
Banana Boat,Sport Coolzone Sunscreen Lotion SPF50PA++++...,HK$114.9
Banana Boat,Banana Boat Ultra Protect Sunscreen Continu...,HK$135.9
Nuxe,Daily UV Protector SPF30 PA+++ (30ml),HK$268.0
Mentholatum,Sunplay Skin Aqua Super Moisture UV Mist SP...,HK$101.9
Hadatuko,Daily Protector SPF24 PA++(Pink) (40ml),HK$229.0
Hadatuko,Perfect UV Cut Spray SPF50+ PA++++ (150ml),HK$198.0
Soo Beauté,Aloe Vera Sun Protection Stick SPF50+ PA+++...,HK$84.0
Soo Beauté,Aloe Vera Triple Defence Sun Spray SPF50+ P...,HK$50.0
Missha,Missha x Line Friends All Around Safe Block...,HK$85.0
Banana Boat,Sport Coolzone After Sun Gel (226g),HK$72.9
Dr. Jart+,Every Sun Day Sun Cream Special Set (with D...,HK$236.0
SNP,SPF 50+ PA+++ Aqua Cooling Sun Spray (150ml...,HK$128.0
Dr. Jart+,Every Sun day Sun Fluid Special Set (with D...,HK$264.0
DR.ORACLE,Brightening Sun Block SPF50+ PA+++ (40ml),HK$78.0
Dr. Jart+,Every Sun Day Tone up Sunscreen SPF50+PA+++...,HK$236.0
KISS MY FACE,Face factor SPF 50 (59ml),HK$118.0
The Saem,Eco Earth Power Perfection Waterproof Sunbl...,HK$130.0
Miccosmo,Adult Block D SPRF 50+ PA+++ (30ml),HK$105.0
